{
  "world_id": "WLD-1f591576-f6c4-4c77-a975-08494320662d",
  "task_id": "TSK-90b6e64c-fe5c-429e-961f-a255d86643d9",
  "run_id": "RUN-438e830b-97d6-453c-ae5a-925c56af1a19",
  "agent_run_id": "ARN-8cce4a68-5d8f-4539-a47c-a64cb5e7e10d",
  "artifact_id": "ART-0a287090-4790-4396-8b26-e33a313b006b",
  "canon_version": "CANON-191e98e943d3ff56d7479b8ff0e41e56b729a18a70a24555365a21f0aedb5168",
  "summary": "TEST FIXTURE: no model, research, or computation was run.",
  "claims": [
    {
      "claim_id": "CLM-a0ffbcd3-43bc-4b16-9009-bf9f3bbbd4d7",
      "category": "OPEN QUESTION",
      "statement": "TEST FIXTURE: this conceptual propulsion question has not been researched.",
      "evidence_ids": [],
      "entity_ids": [
        "TECH-001"
      ],
      "reasoning": "No research or computation was performed.",
      "assumptions": [],
      "uncertainty": "Synthetic example only; feasibility unknown.",
      "counterexamples": []
    }
  ],
  "assumptions": [],
  "open_questions": [
    "Await actual research."
  ],
  "metadata": {
    "test_fixture": true
  },
  "result_type": "research",
  "evidence": [
    {
      "evidence_id": "EVD-359a5e64-c118-494e-9fc2-598e27c40261",
      "claim_id": "CLM-a0ffbcd3-43bc-4b16-9009-bf9f3bbbd4d7",
      "source": {
        "source_type": "test_fixture",
        "title": "TEST FIXTURE: no actual source",
        "url": "https://example.invalid/test-fixture",
        "authors": [],
        "journal_or_conference": null,
        "year": null,
        "doi": null,
        "date": null
      },
      "field": "schema testing",
      "what_was_actually_demonstrated": "No scientific result was demonstrated.",
      "applicable_conditions": [
        "Schema testing only"
      ],
      "what_it_does_not_demonstrate": [
        "Any real-world claim"
      ],
      "confidence": 0,
      "confidence_rationale": "No source has been read.",
      "supported_claims": [
        "CLM-a0ffbcd3-43bc-4b16-9009-bf9f3bbbd4d7"
      ],
      "supported_entities": [
        "TECH-001"
      ],
      "verification": {
        "status": "synthetic",
        "accessed_at": null,
        "method": null,
        "locator": null,
        "excerpt": null
      },
      "last_updated": "2026-10-03T12:06:50.937415Z"
    }
  ],
  "search_log": []
}
